{
  "initial_state": "draft",
  "states": [
    {"id": "draft", "static_guidance": "Prepare.", "final": false},
    {"id": "done", "static_guidance": {"kind": "none"}, "final": true}
  ],
  "transitions": [{"source_state": "draft", "event": "submit", "target_state": "done", "gate_ids": ["review-approved", "tests-passed"]}],
  "input_declarations": [],
  "live_guidance_supported": false
}
